{
  "format": "forge-cartridge-v1",
  "keyframes": [
    {
      "boost": 1.0,
      "label": "M0_Q0",
      "packedWords": [
        [
          46205,
          62586,
          10179,
          40290,
          21134
        ],
        [
          46216,
          62586,
          19259,
          40290,
          28920
        ],
        [
          46275,
          62586,
          28975,
          40290,
          39546
        ],
        [
          46362,
          62586,
          33429,
          40290,
          44077
        ],
        [
          47511,
          62586,
          45788,
          40290,
          55190
        ],
        [
          61367,
          61521,
          61033,
          40290,
          53864
        ]
      ]
    },
    {
      "boost": 1.0,
      "label": "M100_Q0",
      "packedWords": [
        [
          46205,
          62586,
          10179,
          40290,
          21134
        ],
        [
          46216,
          62586,
          19259,
          40290,
          28920
        ],
        [
          46236,
          62586,
          24629,
          40290,
          35113
        ],
        [
          47096,
          62586,
          43476,
          40290,
          53565
        ],
        [
          47666,
          62586,
          46357,
          40290,
          55745
        ],
        [
          61367,
          61521,
          61033,
          40290,
          53864
        ]
      ]
    },
    {
      "boost": 1.0,
      "label": "M0_Q100",
      "packedWords": [
        [
          46205,
          62586,
          9392,
          32118,
          20519
        ],
        [
          46216,
          62586,
          19091,
          32118,
          28816
        ],
        [
          46275,
          62586,
          28973,
          32118,
          39544
        ],
        [
          46362,
          62586,
          33442,
          32118,
          44097
        ],
        [
          47511,
          62586,
          45813,
          32118,
          55220
        ],
        [
          61367,
          61521,
          61075,
          32118,
          53890
        ]
      ]
    },
    {
      "boost": 1.0,
      "label": "M100_Q100",
      "packedWords": [
        [
          46205,
          62586,
          9392,
          32118,
          20519
        ],
        [
          46216,
          62586,
          19091,
          32118,
          28816
        ],
        [
          46236,
          62586,
          24600,
          32118,
          35068
        ],
        [
          47096,
          62586,
          43509,
          32118,
          53587
        ],
        [
          47666,
          62586,
          46385,
          32118,
          55779
        ],
        [
          61367,
          61521,
          61075,
          32118,
          53890
        ]
      ]
    }
  ],
  "meta": {
    "family": "vocal",
    "note": "rounded low back (as in 'bought') -> lax bright vowel (as in 'bit')",
    "source": "tables/ physical models"
  },
  "name": "vocal_aw_to_ih",
  "recipe": {
    "axes": {
      "morph": {
        "high": "AWAY",
        "low": "HOME",
        "scale": "log",
        "slide_semitones": 0.0
      },
      "secondary": {
        "amount": 0.25,
        "high": "TIGHT",
        "low": "OPEN",
        "mode": "q_crank"
      }
    },
    "constraints": {
      "headroom_db": 18.0,
      "max_radius": 0.999,
      "on_unstable": "reject",
      "unity_dc": true
    },
    "lanes": [
      {
        "anatomy": {
          "pole_hz": 110.0,
          "sharp": 0.9928
        },
        "articulation": {
          "cut": "hug"
        },
        "id": 0,
        "label": "sub dome",
        "role": "foundation",
        "survival": {
          "gain": 1.0
        }
      },
      {
        "anatomy": {
          "pole_hz": 250.4,
          "sharp": 0.9928
        },
        "articulation": {
          "cut": "hug"
        },
        "id": 1,
        "label": "fill",
        "role": "filler",
        "survival": {
          "gain": 0.8
        }
      },
      {
        "anatomy": {
          "away_hz": 390.0,
          "pole_hz": 570.0,
          "sharp": 0.9928
        },
        "articulation": {
          "cut": "hug"
        },
        "id": 2,
        "label": "F1",
        "role": "F1",
        "survival": {
          "gain": 1.0
        }
      },
      {
        "anatomy": {
          "away_hz": 1990.0,
          "pole_hz": 840.0,
          "sharp": 0.9928
        },
        "articulation": {
          "cut": "hug"
        },
        "id": 3,
        "label": "F2",
        "role": "F2",
        "survival": {
          "gain": 1.0
        }
      },
      {
        "anatomy": {
          "away_hz": 2550.0,
          "pole_hz": 2410.0,
          "sharp": 0.9928
        },
        "articulation": {
          "cut": "hug"
        },
        "id": 4,
        "label": "F3",
        "role": "F3",
        "survival": {
          "gain": 1.0
        }
      },
      {
        "anatomy": {
          "pole_hz": 9500.0,
          "sharp": 0.9928
        },
        "articulation": {
          "cut": "air_kill"
        },
        "id": 5,
        "label": "air cap",
        "role": "edge_cap",
        "survival": {
          "gain": 0.6
        }
      }
    ]
  },
  "sampleRate": 39062.5
}