{
  "format": "forge-cartridge-v1",
  "keyframes": [
    {
      "boost": 1.0,
      "label": "M0_Q0",
      "packedWords": [
        [
          46205,
          62586,
          9377,
          30862,
          20507
        ],
        [
          46220,
          62586,
          20635,
          30862,
          31196
        ],
        [
          46428,
          62586,
          35429,
          30862,
          46020
        ],
        [
          44742,
          51445,
          44972,
          30862,
          53788
        ],
        [
          48223,
          62586,
          48431,
          30862,
          57460
        ],
        [
          62581,
          62586,
          56196,
          30862,
          49462
        ]
      ]
    },
    {
      "boost": 1.0,
      "label": "M100_Q0",
      "packedWords": [
        [
          46205,
          62586,
          9377,
          30862,
          20507
        ],
        [
          46235,
          62586,
          24208,
          30862,
          34747
        ],
        [
          46645,
          62586,
          39376,
          30862,
          49816
        ],
        [
          46821,
          51445,
          47034,
          30862,
          53820
        ],
        [
          49290,
          62586,
          50979,
          30862,
          58977
        ],
        [
          62581,
          62586,
          59135,
          30862,
          52422
        ]
      ]
    },
    {
      "boost": 1.0,
      "label": "M0_Q100",
      "packedWords": [
        [
          46205,
          62586,
          9359,
          28767,
          20493
        ],
        [
          46220,
          62586,
          20634,
          28767,
          31195
        ],
        [
          46428,
          62586,
          35432,
          28767,
          46023
        ],
        [
          44742,
          51445,
          44976,
          28767,
          53791
        ],
        [
          48223,
          62586,
          48435,
          28767,
          57462
        ],
        [
          62581,
          62586,
          56200,
          28767,
          49465
        ]
      ]
    },
    {
      "boost": 1.0,
      "label": "M100_Q100",
      "packedWords": [
        [
          46205,
          62586,
          9359,
          28767,
          20493
        ],
        [
          46235,
          62586,
          24210,
          28767,
          34748
        ],
        [
          46645,
          62586,
          39379,
          28767,
          49818
        ],
        [
          46821,
          51445,
          47037,
          28767,
          53823
        ],
        [
          49290,
          62586,
          50982,
          28767,
          58980
        ],
        [
          62581,
          62586,
          59138,
          28767,
          52425
        ]
      ]
    }
  ],
  "meta": {
    "family": "resonant",
    "note": "warm brass bell -> single-pitch scream",
    "source": "tables/ physical models"
  },
  "name": "resonant_brass_bell_to_single_scream",
  "recipe": {
    "axes": {
      "morph": {
        "high": "AWAY",
        "low": "HOME",
        "scale": "log",
        "slide_semitones": 0.0
      },
      "secondary": {
        "amount": 0.25,
        "high": "TIGHT",
        "low": "OPEN",
        "mode": "q_crank"
      }
    },
    "constraints": {
      "headroom_db": 18.0,
      "max_radius": 0.999,
      "on_unstable": "reject",
      "unity_dc": true
    },
    "lanes": [
      {
        "anatomy": {
          "pole_hz": 110.0,
          "sharp": 0.9985
        },
        "articulation": {
          "cut": "hug"
        },
        "id": 0,
        "label": "sub dome",
        "role": "foundation",
        "survival": {
          "gain": 1.0
        }
      },
      {
        "anatomy": {
          "away_hz": 380.0,
          "pole_hz": 280.0,
          "sharp": 0.9985
        },
        "articulation": {
          "cut": "hug"
        },
        "id": 1,
        "label": "low_mode",
        "role": "low_mode",
        "survival": {
          "gain": 1.0
        }
      },
      {
        "anatomy": {
          "away_hz": 1400.0,
          "pole_hz": 1000.0,
          "sharp": 0.9985
        },
        "articulation": {
          "cut": "hug"
        },
        "id": 2,
        "label": "mid_mode",
        "role": "mid_mode",
        "survival": {
          "gain": 1.0
        }
      },
      {
        "anatomy": {
          "away_hz": 2700.0,
          "pole_hz": 2200.0,
          "sharp": 0.9985
        },
        "articulation": {
          "cut": "custom",
          "zero": {
            "depth": 0.95,
            "ratio": 1.0
          }
        },
        "id": 3,
        "label": "scoop_notch",
        "role": "scoop_notch",
        "survival": {
          "gain": 0.55
        }
      },
      {
        "anatomy": {
          "away_hz": 3800.0,
          "pole_hz": 3000.0,
          "sharp": 0.9985
        },
        "articulation": {
          "cut": "hug"
        },
        "id": 4,
        "label": "hi_mode",
        "role": "hi_mode",
        "survival": {
          "gain": 1.0
        }
      },
      {
        "anatomy": {
          "away_hz": 8000.0,
          "pole_hz": 6000.0,
          "sharp": 0.9985
        },
        "articulation": {
          "cut": "air_cap"
        },
        "id": 5,
        "label": "top_mode",
        "role": "top_mode",
        "survival": {
          "gain": 0.8
        }
      }
    ]
  },
  "sampleRate": 39062.5
}