{
  "format": "forge-cartridge-v1",
  "keyframes": [
    {
      "boost": 1.0,
      "label": "M0_Q0",
      "packedWords": [
        [
          46283,
          62586,
          29448,
          30862,
          40265
        ],
        [
          46446,
          62586,
          35951,
          30862,
          46394
        ],
        [
          46644,
          62586,
          39357,
          30862,
          49803
        ],
        [
          46773,
          62586,
          41120,
          30862,
          51053
        ],
        [
          47197,
          62586,
          44259,
          30862,
          54007
        ],
        [
          47455,
          62586,
          45610,
          30862,
          55016
        ]
      ]
    },
    {
      "boost": 1.0,
      "label": "M100_Q0",
      "packedWords": [
        [
          46347,
          62586,
          33000,
          30862,
          43445
        ],
        [
          46635,
          62586,
          39226,
          30862,
          49716
        ],
        [
          46986,
          62586,
          42702,
          30862,
          52990
        ],
        [
          47216,
          62586,
          44398,
          30862,
          54084
        ],
        [
          47965,
          62586,
          47484,
          30862,
          56781
        ],
        [
          48420,
          62586,
          49149,
          30862,
          57743
        ]
      ]
    },
    {
      "boost": 1.0,
      "label": "M0_Q100",
      "packedWords": [
        [
          46283,
          62586,
          29450,
          28767,
          40268
        ],
        [
          46446,
          62586,
          35955,
          28767,
          46396
        ],
        [
          46644,
          62586,
          39360,
          28767,
          49806
        ],
        [
          46773,
          62586,
          41122,
          28767,
          51056
        ],
        [
          47197,
          62586,
          44262,
          28767,
          54010
        ],
        [
          47455,
          62586,
          45612,
          28767,
          55019
        ]
      ]
    },
    {
      "boost": 1.0,
      "label": "M100_Q100",
      "packedWords": [
        [
          46347,
          62586,
          33002,
          28767,
          43448
        ],
        [
          46635,
          62586,
          39230,
          28767,
          49719
        ],
        [
          46986,
          62586,
          42705,
          28767,
          52994
        ],
        [
          47216,
          62586,
          44402,
          28767,
          54086
        ],
        [
          47965,
          62586,
          47487,
          28767,
          56784
        ],
        [
          48420,
          62586,
          49152,
          28767,
          57746
        ]
      ]
    }
  ],
  "meta": {
    "family": "metal",
    "note": "dense, closely-packed inharmonic modes -> shimmery metallic wash",
    "source": "tables/ physical models"
  },
  "name": "metal_free_plate",
  "recipe": {
    "axes": {
      "morph": {
        "high": "AWAY",
        "low": "HOME",
        "scale": "log",
        "slide_semitones": 0.0
      },
      "secondary": {
        "amount": 0.25,
        "high": "TIGHT",
        "low": "OPEN",
        "mode": "q_crank"
      }
    },
    "constraints": {
      "headroom_db": 18.0,
      "max_radius": 0.999,
      "on_unstable": "reject",
      "unity_dc": true
    },
    "lanes": [
      {
        "anatomy": {
          "away_hz": 800.0,
          "pole_hz": 600.0,
          "sharp": 0.9985
        },
        "articulation": {
          "cut": "hug"
        },
        "id": 0,
        "label": "m1",
        "role": "mode 1",
        "survival": {
          "gain": 1.0
        }
      },
      {
        "anatomy": {
          "away_hz": 1384.0,
          "pole_hz": 1038.0,
          "sharp": 0.9985
        },
        "articulation": {
          "cut": "hug"
        },
        "id": 1,
        "label": "m2",
        "role": "mode 2",
        "survival": {
          "gain": 1.0
        }
      },
      {
        "anatomy": {
          "away_hz": 1864.0,
          "pole_hz": 1398.0,
          "sharp": 0.9985
        },
        "articulation": {
          "cut": "hug"
        },
        "id": 2,
        "label": "m3",
        "role": "mode 3",
        "survival": {
          "gain": 1.0
        }
      },
      {
        "anatomy": {
          "away_hz": 2119.9,
          "pole_hz": 1590.0,
          "sharp": 0.9985
        },
        "articulation": {
          "cut": "hug"
        },
        "id": 3,
        "label": "m4",
        "role": "mode 4",
        "survival": {
          "gain": 1.0
        }
      },
      {
        "anatomy": {
          "away_hz": 2799.9,
          "pole_hz": 2100.0,
          "sharp": 0.9985
        },
        "articulation": {
          "cut": "hug"
        },
        "id": 4,
        "label": "m5",
        "role": "mode 5",
        "survival": {
          "gain": 1.0
        }
      },
      {
        "anatomy": {
          "away_hz": 3143.9,
          "pole_hz": 2358.0,
          "sharp": 0.9985
        },
        "articulation": {
          "cut": "hug"
        },
        "id": 5,
        "label": "m6",
        "role": "mode 6",
        "survival": {
          "gain": 1.0
        }
      }
    ]
  },
  "sampleRate": 39062.5
}