{
  "format": "forge-cartridge-v1",
  "keyframes": [
    {
      "boost": 1.0,
      "label": "M0_Q0",
      "packedWords": [
        [
          46205,
          62586,
          9377,
          30862,
          20507
        ],
        [
          46213,
          62586,
          17540,
          30862,
          28670
        ],
        [
          46271,
          62586,
          28681,
          30862,
          37833
        ],
        [
          46632,
          62586,
          39177,
          30862,
          49684
        ],
        [
          49341,
          62586,
          51165,
          30862,
          59085
        ],
        [
          53530,
          62586,
          58592,
          30862,
          62343
        ]
      ]
    },
    {
      "boost": 1.0,
      "label": "M100_Q0",
      "packedWords": [
        [
          46205,
          62586,
          9377,
          30862,
          20507
        ],
        [
          46221,
          62586,
          21047,
          30862,
          31836
        ],
        [
          46271,
          62586,
          28681,
          30862,
          37833
        ],
        [
          46965,
          62586,
          42543,
          30862,
          52802
        ],
        [
          50603,
          62586,
          54446,
          30862,
          61066
        ],
        [
          55684,
          62586,
          61645,
          30862,
          62737
        ]
      ]
    },
    {
      "boost": 1.0,
      "label": "M0_Q100",
      "packedWords": [
        [
          46205,
          62586,
          9359,
          28767,
          20493
        ],
        [
          46213,
          62586,
          17538,
          28767,
          28666
        ],
        [
          46271,
          62586,
          28682,
          28767,
          37835
        ],
        [
          46632,
          62586,
          39180,
          28767,
          49686
        ],
        [
          49341,
          62586,
          51168,
          28767,
          59088
        ],
        [
          53530,
          62586,
          58595,
          28767,
          62346
        ]
      ]
    },
    {
      "boost": 1.0,
      "label": "M100_Q100",
      "packedWords": [
        [
          46205,
          62586,
          9359,
          28767,
          20493
        ],
        [
          46221,
          62586,
          21047,
          28767,
          31836
        ],
        [
          46271,
          62586,
          28682,
          28767,
          37835
        ],
        [
          46965,
          62586,
          42546,
          28767,
          52806
        ],
        [
          50603,
          62586,
          54449,
          28767,
          61070
        ],
        [
          55684,
          62586,
          61647,
          28767,
          62740
        ]
      ]
    }
  ],
  "meta": {
    "family": "metal",
    "note": "huge gaps between partials -> pure, woody-metallic ping",
    "source": "tables/ physical models"
  },
  "name": "metal_clamped_bar",
  "recipe": {
    "axes": {
      "morph": {
        "high": "AWAY",
        "low": "HOME",
        "scale": "log",
        "slide_semitones": 0.0
      },
      "secondary": {
        "amount": 0.25,
        "high": "TIGHT",
        "low": "OPEN",
        "mode": "q_crank"
      }
    },
    "constraints": {
      "headroom_db": 18.0,
      "max_radius": 0.999,
      "on_unstable": "reject",
      "unity_dc": true
    },
    "lanes": [
      {
        "anatomy": {
          "pole_hz": 110.0,
          "sharp": 0.9985
        },
        "articulation": {
          "cut": "hug"
        },
        "id": 0,
        "label": "sub dome",
        "role": "foundation",
        "survival": {
          "gain": 1.0
        }
      },
      {
        "anatomy": {
          "away_hz": 293.3,
          "pole_hz": 220.0,
          "sharp": 0.9985
        },
        "articulation": {
          "cut": "hug"
        },
        "id": 1,
        "label": "m1",
        "role": "mode 1",
        "survival": {
          "gain": 1.0
        }
      },
      {
        "anatomy": {
          "pole_hz": 550.7,
          "sharp": 0.9985
        },
        "articulation": {
          "cut": "hug"
        },
        "id": 2,
        "label": "fill",
        "role": "filler",
        "survival": {
          "gain": 0.8
        }
      },
      {
        "anatomy": {
          "away_hz": 1838.3,
          "pole_hz": 1378.7,
          "sharp": 0.9985
        },
        "articulation": {
          "cut": "hug"
        },
        "id": 3,
        "label": "m2",
        "role": "mode 2",
        "survival": {
          "gain": 1.0
        }
      },
      {
        "anatomy": {
          "away_hz": 5147.9,
          "pole_hz": 3861.0,
          "sharp": 0.9985
        },
        "articulation": {
          "cut": "hug"
        },
        "id": 4,
        "label": "m3",
        "role": "mode 3",
        "survival": {
          "gain": 1.0
        }
      },
      {
        "anatomy": {
          "away_hz": 10087.5,
          "pole_hz": 7565.8,
          "sharp": 0.9985
        },
        "articulation": {
          "cut": "hug"
        },
        "id": 5,
        "label": "m4",
        "role": "mode 4",
        "survival": {
          "gain": 1.0
        }
      }
    ]
  },
  "sampleRate": 39062.5
}