{
  "format": "forge-cartridge-v1",
  "keyframes": [
    {
      "boost": 1.0,
      "label": "M0_Q0",
      "packedWords": [
        [
          46205,
          62586,
          9708,
          37788,
          20766
        ],
        [
          46209,
          62586,
          15382,
          37788,
          26089
        ],
        [
          46254,
          62586,
          26721,
          37788,
          37595
        ],
        [
          46645,
          62586,
          39357,
          37788,
          49802
        ],
        [
          48150,
          51445,
          48407,
          37788,
          53818
        ],
        [
          54131,
          54184,
          53232,
          37788,
          55876
        ]
      ]
    },
    {
      "boost": 1.0,
      "label": "M100_Q0",
      "packedWords": [
        [
          46205,
          62586,
          9708,
          37788,
          20766
        ],
        [
          46217,
          62586,
          19683,
          37788,
          30336
        ],
        [
          46319,
          62586,
          31577,
          37788,
          42214
        ],
        [
          47293,
          62586,
          44947,
          37788,
          54378
        ],
        [
          50171,
          51445,
          50372,
          37788,
          53834
        ],
        [
          58095,
          54184,
          57280,
          37788,
          56019
        ]
      ]
    },
    {
      "boost": 1.0,
      "label": "M0_Q100",
      "packedWords": [
        [
          46205,
          62586,
          9365,
          29605,
          20498
        ],
        [
          46209,
          62586,
          15226,
          29605,
          25967
        ],
        [
          46254,
          62586,
          26721,
          29605,
          37595
        ],
        [
          46645,
          62586,
          39378,
          29605,
          49817
        ],
        [
          48150,
          51445,
          48433,
          29605,
          53834
        ],
        [
          54131,
          54184,
          53254,
          29605,
          55900
        ]
      ]
    },
    {
      "boost": 1.0,
      "label": "M100_Q100",
      "packedWords": [
        [
          46205,
          62586,
          9365,
          29605,
          20498
        ],
        [
          46217,
          62586,
          19619,
          29605,
          30286
        ],
        [
          46319,
          62586,
          31591,
          29605,
          42225
        ],
        [
          47293,
          62586,
          44975,
          29605,
          54396
        ],
        [
          50171,
          51445,
          50391,
          29605,
          53850
        ],
        [
          58095,
          54184,
          57309,
          29605,
          56043
        ]
      ]
    }
  ],
  "meta": {
    "family": "knock",
    "note": "soft knock, gentle tear -> sharp snap, bright tear",
    "source": "tables/ physical models"
  },
  "name": "knock_soft_knock_to_snapping_punch",
  "recipe": {
    "axes": {
      "morph": {
        "high": "AWAY",
        "low": "HOME",
        "scale": "log",
        "slide_semitones": 0.0
      },
      "secondary": {
        "amount": 0.25,
        "high": "TIGHT",
        "low": "OPEN",
        "mode": "q_crank"
      }
    },
    "constraints": {
      "headroom_db": 18.0,
      "max_radius": 0.999,
      "on_unstable": "reject",
      "unity_dc": true
    },
    "lanes": [
      {
        "anatomy": {
          "pole_hz": 110.0,
          "sharp": 0.9952
        },
        "articulation": {
          "cut": "hug"
        },
        "id": 0,
        "label": "sub dome",
        "role": "foundation",
        "survival": {
          "gain": 1.0
        }
      },
      {
        "anatomy": {
          "away_hz": 260.0,
          "pole_hz": 180.0,
          "sharp": 0.9952
        },
        "articulation": {
          "cut": "hug"
        },
        "id": 1,
        "label": "knock",
        "role": "knock",
        "survival": {
          "gain": 1.0
        }
      },
      {
        "anatomy": {
          "away_hz": 720.0,
          "pole_hz": 480.0,
          "sharp": 0.9952
        },
        "articulation": {
          "cut": "hug"
        },
        "id": 2,
        "label": "body",
        "role": "body",
        "survival": {
          "gain": 1.0
        }
      },
      {
        "anatomy": {
          "away_hz": 2200.0,
          "pole_hz": 1400.0,
          "sharp": 0.9952
        },
        "articulation": {
          "cut": "hug"
        },
        "id": 3,
        "label": "grit",
        "role": "grit",
        "survival": {
          "gain": 1.0
        }
      },
      {
        "anatomy": {
          "away_hz": 3600.0,
          "pole_hz": 3000.0,
          "sharp": 0.9952
        },
        "articulation": {
          "cut": "custom",
          "zero": {
            "depth": 0.95,
            "ratio": 1.0
          }
        },
        "id": 4,
        "label": "scoop_notch",
        "role": "scoop_notch",
        "survival": {
          "gain": 0.55
        }
      },
      {
        "anatomy": {
          "away_hz": 6500.0,
          "pole_hz": 4500.0,
          "sharp": 0.9952
        },
        "articulation": {
          "cut": "tear"
        },
        "id": 5,
        "label": "tear",
        "role": "tear",
        "survival": {
          "gain": 1.0
        }
      }
    ]
  },
  "sampleRate": 39062.5
}