{
  "format": "forge-cartridge-v1",
  "keyframes": [
    {
      "boost": 1.0,
      "label": "M0_Q0",
      "packedWords": [
        [
          46283,
          62586,
          29444,
          38623,
          40258
        ],
        [
          33444,
          51445,
          32990,
          38623,
          53208
        ],
        [
          41653,
          51445,
          41708,
          38623,
          53708
        ],
        [
          47293,
          62586,
          44941,
          38623,
          54374
        ],
        [
          49900,
          51445,
          50084,
          38623,
          53828
        ],
        [
          58266,
          51445,
          58490,
          38623,
          53858
        ]
      ]
    },
    {
      "boost": 1.0,
      "label": "M100_Q0",
      "packedWords": [
        [
          46347,
          62586,
          32990,
          38623,
          43429
        ],
        [
          35756,
          51445,
          35409,
          38623,
          53436
        ],
        [
          43415,
          51445,
          43551,
          38623,
          53751
        ],
        [
          47842,
          62586,
          47010,
          38623,
          56352
        ],
        [
          52572,
          51445,
          52881,
          38623,
          53842
        ],
        [
          60707,
          51445,
          61045,
          38623,
          53861
        ]
      ]
    },
    {
      "boost": 1.0,
      "label": "M0_Q100",
      "packedWords": [
        [
          46283,
          62586,
          29449,
          30443,
          40266
        ],
        [
          33444,
          51445,
          33000,
          30443,
          53228
        ],
        [
          41653,
          51445,
          41726,
          30443,
          53725
        ],
        [
          47293,
          62586,
          44973,
          30443,
          54395
        ],
        [
          49900,
          51445,
          50105,
          30443,
          53847
        ],
        [
          58266,
          51445,
          58512,
          30443,
          53877
        ]
      ]
    },
    {
      "boost": 1.0,
      "label": "M100_Q100",
      "packedWords": [
        [
          46347,
          62586,
          33000,
          30443,
          43445
        ],
        [
          35756,
          51445,
          35430,
          30443,
          53449
        ],
        [
          43415,
          51445,
          43578,
          30443,
          53769
        ],
        [
          47842,
          62586,
          47034,
          30443,
          56382
        ],
        [
          52572,
          51445,
          52914,
          30443,
          53861
        ],
        [
          60707,
          51445,
          61078,
          30443,
          53881
        ]
      ]
    }
  ],
  "meta": {
    "family": "comb",
    "note": "chambered phaser -> phasing sweep",
    "source": "tables/ physical models"
  },
  "name": "comb_chambered_phaser_to_phasing_sweep",
  "recipe": {
    "axes": {
      "morph": {
        "high": "AWAY",
        "low": "HOME",
        "scale": "log",
        "slide_semitones": 0.0
      },
      "secondary": {
        "amount": 0.25,
        "high": "TIGHT",
        "low": "OPEN",
        "mode": "q_crank"
      }
    },
    "constraints": {
      "headroom_db": 18.0,
      "max_radius": 0.999,
      "on_unstable": "reject",
      "unity_dc": true
    },
    "lanes": [
      {
        "anatomy": {
          "away_hz": 800.0,
          "pole_hz": 600.0,
          "sharp": 0.9944
        },
        "articulation": {
          "cut": "hug"
        },
        "id": 0,
        "label": "peak_low",
        "role": "peak_low",
        "survival": {
          "gain": 1.0
        }
      },
      {
        "anatomy": {
          "away_hz": 1000.0,
          "pole_hz": 800.0,
          "sharp": 0.9944
        },
        "articulation": {
          "cut": "custom",
          "zero": {
            "depth": 0.95,
            "ratio": 1.0
          }
        },
        "id": 1,
        "label": "notch_1",
        "role": "notch_1",
        "survival": {
          "gain": 0.55
        }
      },
      {
        "anatomy": {
          "away_hz": 2000.0,
          "pole_hz": 1700.0,
          "sharp": 0.9944
        },
        "articulation": {
          "cut": "custom",
          "zero": {
            "depth": 0.95,
            "ratio": 1.0
          }
        },
        "id": 2,
        "label": "notch_2",
        "role": "notch_2",
        "survival": {
          "gain": 0.55
        }
      },
      {
        "anatomy": {
          "away_hz": 2700.0,
          "pole_hz": 2200.0,
          "sharp": 0.9944
        },
        "articulation": {
          "cut": "hug"
        },
        "id": 3,
        "label": "peak_high",
        "role": "peak_high",
        "survival": {
          "gain": 1.0
        }
      },
      {
        "anatomy": {
          "away_hz": 4400.0,
          "pole_hz": 3500.0,
          "sharp": 0.9944
        },
        "articulation": {
          "cut": "custom",
          "zero": {
            "depth": 0.95,
            "ratio": 1.0
          }
        },
        "id": 4,
        "label": "notch_3",
        "role": "notch_3",
        "survival": {
          "gain": 0.55
        }
      },
      {
        "anatomy": {
          "away_hz": 9500.0,
          "pole_hz": 7500.0,
          "sharp": 0.9944
        },
        "articulation": {
          "cut": "custom",
          "zero": {
            "depth": 0.95,
            "ratio": 1.0
          }
        },
        "id": 5,
        "label": "notch_4",
        "role": "notch_4",
        "survival": {
          "gain": 0.55
        }
      }
    ]
  },
  "sampleRate": 39062.5
}