{
  "format": "forge-cartridge-v1",
  "keyframes": [
    {
      "boost": 1.0,
      "label": "M0_Q0",
      "packedWords": [
        [
          46205,
          62586,
          9595,
          36953,
          20677
        ],
        [
          46217,
          62586,
          19659,
          36953,
          30318
        ],
        [
          46711,
          62586,
          40332,
          36953,
          50442
        ],
        [
          45623,
          51445,
          45763,
          36953,
          53792
        ],
        [
          54765,
          54184,
          53778,
          36953,
          55903
        ],
        [
          60084,
          51445,
          60404,
          36953,
          53868
        ]
      ]
    },
    {
      "boost": 1.0,
      "label": "M100_Q0",
      "packedWords": [
        [
          46205,
          62586,
          9595,
          36953,
          20677
        ],
        [
          46213,
          62586,
          17585,
          36953,
          28705
        ],
        [
          46476,
          62586,
          36828,
          36953,
          47015
        ],
        [
          44742,
          51445,
          44953,
          36953,
          53777
        ],
        [
          54131,
          54184,
          53238,
          36953,
          55882
        ],
        [
          58859,
          51445,
          59120,
          36953,
          53866
        ]
      ]
    },
    {
      "boost": 1.0,
      "label": "M0_Q100",
      "packedWords": [
        [
          46205,
          62586,
          9359,
          28767,
          20493
        ],
        [
          46217,
          62586,
          19619,
          28767,
          30286
        ],
        [
          46711,
          62586,
          40353,
          28767,
          50457
        ],
        [
          45623,
          51445,
          45777,
          28767,
          53806
        ],
        [
          54765,
          54184,
          53792,
          28767,
          55923
        ],
        [
          60084,
          51445,
          60426,
          28767,
          53882
        ]
      ]
    },
    {
      "boost": 1.0,
      "label": "M100_Q100",
      "packedWords": [
        [
          46205,
          62586,
          9359,
          28767,
          20493
        ],
        [
          46213,
          62586,
          17538,
          28767,
          28666
        ],
        [
          46476,
          62586,
          36848,
          28767,
          47030
        ],
        [
          44742,
          51445,
          44976,
          28767,
          53791
        ],
        [
          54131,
          54184,
          53255,
          28767,
          55902
        ],
        [
          58859,
          51445,
          59138,
          28767,
          53880
        ]
      ]
    }
  ],
  "meta": {
    "family": "violence",
    "note": "modal ring at 1.5k/4.8k · plate scoop 2.4k -> sustained throat 1.1k · upper formant 4.5k",
    "source": "tables/ physical models"
  },
  "name": "violence_iron_plate_to_wolf_howl",
  "recipe": {
    "axes": {
      "morph": {
        "high": "AWAY",
        "low": "HOME",
        "scale": "log",
        "slide_semitones": 0.0
      },
      "secondary": {
        "amount": 0.25,
        "high": "TIGHT",
        "low": "OPEN",
        "mode": "q_crank"
      }
    },
    "constraints": {
      "headroom_db": 18.0,
      "max_radius": 0.999,
      "on_unstable": "reject",
      "unity_dc": true
    },
    "lanes": [
      {
        "anatomy": {
          "pole_hz": 110.0,
          "sharp": 0.996
        },
        "articulation": {
          "cut": "hug"
        },
        "id": 0,
        "label": "sub dome",
        "role": "foundation",
        "survival": {
          "gain": 1.0
        }
      },
      {
        "anatomy": {
          "away_hz": 220.0,
          "pole_hz": 260.0,
          "sharp": 0.996
        },
        "articulation": {
          "cut": "hug"
        },
        "id": 1,
        "label": "body",
        "role": "body",
        "survival": {
          "gain": 1.0
        }
      },
      {
        "anatomy": {
          "away_hz": 1100.0,
          "pole_hz": 1500.0,
          "sharp": 0.996
        },
        "articulation": {
          "cut": "hug"
        },
        "id": 2,
        "label": "scream",
        "role": "scream",
        "survival": {
          "gain": 1.0
        }
      },
      {
        "anatomy": {
          "away_hz": 2200.0,
          "pole_hz": 2400.0,
          "sharp": 0.996
        },
        "articulation": {
          "cut": "custom",
          "zero": {
            "depth": 0.95,
            "ratio": 1.0
          }
        },
        "id": 3,
        "label": "scoop",
        "role": "scoop",
        "survival": {
          "gain": 0.55
        }
      },
      {
        "anatomy": {
          "away_hz": 4500.0,
          "pole_hz": 4800.0,
          "sharp": 0.996
        },
        "articulation": {
          "cut": "tear"
        },
        "id": 4,
        "label": "tear",
        "role": "tear",
        "survival": {
          "gain": 1.0
        }
      },
      {
        "anatomy": {
          "away_hz": 8000.0,
          "pole_hz": 9000.0,
          "sharp": 0.996
        },
        "articulation": {
          "cut": "custom",
          "zero": {
            "depth": 0.95,
            "ratio": 1.0
          }
        },
        "id": 5,
        "label": "top_notch",
        "role": "top_notch",
        "survival": {
          "gain": 0.55
        }
      }
    ]
  },
  "sampleRate": 39062.5
}