{
  "format": "forge-cartridge-v1",
  "keyframes": [
    {
      "boost": 1.0,
      "label": "M0_Q0",
      "packedWords": [
        [
          46205,
          62586,
          9431,
          33698,
          20550
        ],
        [
          46217,
          62586,
          19628,
          33698,
          30294
        ],
        [
          46428,
          62586,
          35424,
          33698,
          46016
        ],
        [
          49379,
          51445,
          49553,
          33698,
          53838
        ],
        [
          55885,
          54184,
          54739,
          33698,
          55949
        ],
        [
          61100,
          54184,
          60025,
          33698,
          56222
        ]
      ]
    },
    {
      "boost": 1.0,
      "label": "M100_Q0",
      "packedWords": [
        [
          46205,
          62586,
          9431,
          33698,
          20550
        ],
        [
          46213,
          62586,
          17550,
          33698,
          28678
        ],
        [
          46365,
          62586,
          33553,
          33698,
          44261
        ],
        [
          49900,
          51445,
          50100,
          33698,
          53842
        ],
        [
          56354,
          54184,
          55141,
          33698,
          55963
        ],
        [
          61478,
          54184,
          60415,
          33698,
          56252
        ]
      ]
    },
    {
      "boost": 1.0,
      "label": "M0_Q100",
      "packedWords": [
        [
          46205,
          62586,
          9359,
          28767,
          20493
        ],
        [
          46217,
          62586,
          19619,
          28767,
          30286
        ],
        [
          46428,
          62586,
          35432,
          28767,
          46023
        ],
        [
          49379,
          51445,
          49559,
          28767,
          53844
        ],
        [
          55885,
          54184,
          54747,
          28767,
          55958
        ],
        [
          61100,
          54184,
          60035,
          28767,
          56232
        ]
      ]
    },
    {
      "boost": 1.0,
      "label": "M100_Q100",
      "packedWords": [
        [
          46205,
          62586,
          9359,
          28767,
          20493
        ],
        [
          46213,
          62586,
          17538,
          28767,
          28666
        ],
        [
          46365,
          62586,
          33559,
          28767,
          44269
        ],
        [
          49900,
          51445,
          50107,
          28767,
          53849
        ],
        [
          56354,
          54184,
          55149,
          28767,
          55972
        ],
        [
          61478,
          54184,
          60426,
          28767,
          56262
        ]
      ]
    }
  ],
  "meta": {
    "family": "cut",
    "note": "mid-band fracture -> one moving tear at the top",
    "source": "tables/ physical models"
  },
  "name": "cut_mid_fracture_to_single_tear",
  "recipe": {
    "axes": {
      "morph": {
        "high": "AWAY",
        "low": "HOME",
        "scale": "log",
        "slide_semitones": 0.0
      },
      "secondary": {
        "amount": 0.25,
        "high": "TIGHT",
        "low": "OPEN",
        "mode": "q_crank"
      }
    },
    "constraints": {
      "headroom_db": 18.0,
      "max_radius": 0.999,
      "on_unstable": "reject",
      "unity_dc": true
    },
    "lanes": [
      {
        "anatomy": {
          "pole_hz": 110.0,
          "sharp": 0.9976
        },
        "articulation": {
          "cut": "hug"
        },
        "id": 0,
        "label": "sub dome",
        "role": "foundation",
        "survival": {
          "gain": 1.0
        }
      },
      {
        "anatomy": {
          "away_hz": 220.0,
          "pole_hz": 260.0,
          "sharp": 0.9976
        },
        "articulation": {
          "cut": "hug"
        },
        "id": 1,
        "label": "body_low",
        "role": "body_low",
        "survival": {
          "gain": 1.0
        }
      },
      {
        "anatomy": {
          "away_hz": 850.0,
          "pole_hz": 1000.0,
          "sharp": 0.9976
        },
        "articulation": {
          "cut": "hug"
        },
        "id": 2,
        "label": "body_mid",
        "role": "body_mid",
        "survival": {
          "gain": 1.0
        }
      },
      {
        "anatomy": {
          "away_hz": 3500.0,
          "pole_hz": 3300.0,
          "sharp": 0.9976
        },
        "articulation": {
          "cut": "custom",
          "zero": {
            "depth": 0.95,
            "ratio": 1.0
          }
        },
        "id": 3,
        "label": "scoop_notch",
        "role": "scoop_notch",
        "survival": {
          "gain": 0.55
        }
      },
      {
        "anatomy": {
          "away_hz": 5500.0,
          "pole_hz": 5300.0,
          "sharp": 0.9976
        },
        "articulation": {
          "cut": "tear"
        },
        "id": 4,
        "label": "tear_lo",
        "role": "tear_lo",
        "survival": {
          "gain": 1.0
        }
      },
      {
        "anatomy": {
          "away_hz": 9000.0,
          "pole_hz": 8700.0,
          "sharp": 0.9976
        },
        "articulation": {
          "cut": "tear"
        },
        "id": 5,
        "label": "tear_hi",
        "role": "tear_hi",
        "survival": {
          "gain": 1.0
        }
      }
    ]
  },
  "sampleRate": 39062.5
}