{
  "format": "forge-cartridge-v1",
  "keyframes": [
    {
      "boost": 1.0,
      "label": "M0_Q0",
      "packedWords": [
        [
          46205,
          62586,
          10437,
          36207,
          21335
        ],
        [
          46231,
          62586,
          23299,
          36207,
          34044
        ],
        [
          30819,
          51445,
          29756,
          36207,
          52532
        ],
        [
          46462,
          62586,
          36421,
          36207,
          46728
        ],
        [
          48487,
          62586,
          49263,
          36207,
          56478
        ],
        [
          61367,
          61521,
          61061,
          36207,
          53881
        ]
      ]
    },
    {
      "boost": 1.0,
      "label": "M100_Q0",
      "packedWords": [
        [
          46208,
          62586,
          14045,
          36207,
          25047
        ],
        [
          46267,
          62586,
          28254,
          36207,
          38767
        ],
        [
          34865,
          51445,
          34483,
          36207,
          53379
        ],
        [
          46786,
          62586,
          41208,
          36207,
          51163
        ],
        [
          48487,
          62586,
          49263,
          36207,
          56478
        ],
        [
          61367,
          61521,
          61061,
          36207,
          53881
        ]
      ]
    },
    {
      "boost": 1.0,
      "label": "M0_Q100",
      "packedWords": [
        [
          46205,
          62586,
          10252,
          28767,
          21190
        ],
        [
          46231,
          62586,
          23292,
          28767,
          34039
        ],
        [
          30819,
          51445,
          29763,
          28767,
          52543
        ],
        [
          46462,
          62586,
          36438,
          28767,
          46740
        ],
        [
          48487,
          62586,
          49274,
          28767,
          56496
        ],
        [
          61367,
          61521,
          61081,
          28767,
          53893
        ]
      ]
    },
    {
      "boost": 1.0,
      "label": "M100_Q100",
      "packedWords": [
        [
          46208,
          62586,
          13960,
          28767,
          24981
        ],
        [
          46267,
          62586,
          28262,
          28767,
          38773
        ],
        [
          34865,
          51445,
          34495,
          28767,
          53388
        ],
        [
          46786,
          62586,
          41219,
          28767,
          51178
        ],
        [
          48487,
          62586,
          49274,
          28767,
          56496
        ],
        [
          61367,
          61521,
          61081,
          28767,
          53893
        ]
      ]
    }
  ],
  "meta": {
    "family": "cavity",
    "note": "Helmholtz 119Hz (V=0.75L, neck d=1.85cm L=6.0cm) + body modes 357/1072Hz (closed-pipe, L=24.0cm) -> Helmholtz 163Hz (V=0.355L, neck d=1.6cm L=5.0cm) + body modes 536/1608Hz (closed-pipe, L=16.0cm)",
    "source": "tables/ physical models"
  },
  "name": "cavity_wine_bottle_to_beer_bottle",
  "recipe": {
    "axes": {
      "morph": {
        "high": "AWAY",
        "low": "HOME",
        "scale": "log",
        "slide_semitones": 0.0
      },
      "secondary": {
        "amount": 0.25,
        "high": "TIGHT",
        "low": "OPEN",
        "mode": "q_crank"
      }
    },
    "constraints": {
      "headroom_db": 18.0,
      "max_radius": 0.999,
      "on_unstable": "reject",
      "unity_dc": true
    },
    "lanes": [
      {
        "anatomy": {
          "away_hz": 163.0,
          "pole_hz": 119.0,
          "sharp": 0.9964
        },
        "articulation": {
          "cut": "hug"
        },
        "id": 0,
        "label": "fundamental",
        "role": "fundamental",
        "survival": {
          "gain": 1.0
        }
      },
      {
        "anatomy": {
          "away_hz": 536.0,
          "pole_hz": 357.0,
          "sharp": 0.9964
        },
        "articulation": {
          "cut": "hug"
        },
        "id": 1,
        "label": "second_mode",
        "role": "second_mode",
        "survival": {
          "gain": 1.0
        }
      },
      {
        "anatomy": {
          "away_hz": 928.0,
          "pole_hz": 619.0,
          "sharp": 0.9964
        },
        "articulation": {
          "cut": "custom",
          "zero": {
            "depth": 0.95,
            "ratio": 1.0
          }
        },
        "id": 2,
        "label": "scoop_notch",
        "role": "scoop_notch",
        "survival": {
          "gain": 0.55
        }
      },
      {
        "anatomy": {
          "away_hz": 1608.0,
          "pole_hz": 1072.0,
          "sharp": 0.9964
        },
        "articulation": {
          "cut": "hug"
        },
        "id": 3,
        "label": "upper_mode",
        "role": "upper_mode",
        "survival": {
          "gain": 1.0
        }
      },
      {
        "anatomy": {
          "pole_hz": 3191.2,
          "sharp": 0.9964
        },
        "articulation": {
          "cut": "hug"
        },
        "id": 4,
        "label": "fill",
        "role": "filler",
        "survival": {
          "gain": 0.8
        }
      },
      {
        "anatomy": {
          "pole_hz": 9500.0,
          "sharp": 0.9964
        },
        "articulation": {
          "cut": "air_kill"
        },
        "id": 5,
        "label": "air cap",
        "role": "edge_cap",
        "survival": {
          "gain": 0.6
        }
      }
    ]
  },
  "sampleRate": 39062.5
}